{
  "input_map": "/home/tzkr/python_workspace/HouseExpo/experiments/map_id_100/ea41bd11b5c0b769558a620734451d99_obs_num_0.0_slamErr_linear_0.0_slamErr_angular_0.0_laser_noise_0.png",
  "map_description": "Perfect simple map from house expo examples",
  "peak_extraction_parameters": {
    "peak_height": 0.2,
    "smooth_histogram": true,
    "sigma": 0.5
  },
  "filtering_parameters": {
    "filter_level": 0.18
  },
  "visualisation_flags": {
    "Binary map": false,
    "Unfolded FFT Spectrum": false,
    "Map with directions": false,
    "Map with walls": false,
    "Wall lines from mbb": false,
    "Short wall lines from mbb": false,
    "Short wall lines over original map": true,
    "Map with slices": false,
    "Map Scored Good": false
  }
}