{
  "input_map": "test_map.png",
  "map_description": "map of real building from Freiburg",
  "peak_extraction_parameters": {
    "peak_height": 0.05,
    "smooth_histogram": true,
    "sigma": 0.5
  },
  "filtering_parameters": {
    "filter_level": 0.18
  },
  "visualisation_flags": {
    "Binary map": false,
    "Unfolded FFT Spectrum": true,
    "Map with directions": true,
    "Map with walls": false,
    "Wall lines from mbb": false,
    "Map with slices": false,
    "Map Scored Good": true,
    "FFT spectrum with directions": true,
    "FFT Spectrum Signal": true
  }
}