{
  "input_map": "/home/tzkr/python_workspace/rose/Maps/output.png",
  "map_description": "map of real building from Freiburg",
  "peak_extraction_parameters": {
    "peak_height": 0.05,
    "smooth_histogram": true,
    "sigma": 0.5
  },
  "filtering_parameters": {
    "filter_level": 0.18
  },
  "visualisation_flags": {
    "Binary map": true,
    "Unfolded FFT Spectrum": false,
    "Map with directions": true,
    "Map with walls": true,
    "Wall lines from mbb": true,
    "Short wall lines from mbb": true,
    "Short wall lines over original map": true,
    "Map with slices": true,
    "Map Scored Good": false,
    "evaluation output": false,
    "Raw line segments": true
  }
}