{
  "input_map": "/home/tzkr/Data/MQ/2D_occ_maps/fr101.good.png",
  "map_description": "map of real building from Freiburg",
  "peak_extraction_parameters": {
    "peak_height": 0.2,
    "smooth_histogram": true,
    "sigma": 0.5
  },
  "filtering_parameters": {
    "filter_level": 0.18
  },
  "visualisation_flags": {
    "Binary map": false,
    "Unfolded FFT Spectrum": true,
    "Map with directions": false,
    "Map with walls": false,
    "Wall lines from mbb": false,
    "Short wall lines from mbb": false,
    "Short wall lines over original map": true,
    "Map with slices": false,
    "Map Scored Good": false
  }
}